{
  "$schema": "https://json-schema.org/draft/2020-12/schema",
  "$id": "https://lxe-agent.local/protocol/inbound-event.schema.json",
  "title": "InboundEvent",
  "type": "object",
  "additionalProperties": false,
  "required": [
    "platform",
    "event_type",
    "user_input",
    "user_id",
    "conversation_id",
    "is_group",
    "message_id",
    "sender_nick",
    "response_route_id",
    "union_id",
    "source",
    "raw_data",
    "user_content_blocks",
    "diagnostics"
  ],
  "properties": {
    "platform": { "type": "string", "minLength": 1 },
    "event_type": { "type": "string", "minLength": 1 },
    "user_input": { "type": "string" },
    "user_id": { "type": "string", "minLength": 1 },
    "conversation_id": { "type": "string", "minLength": 1 },
    "is_group": { "type": "boolean" },
    "message_id": { "type": "string", "minLength": 1 },
    "sender_nick": { "type": "string" },
    "response_route_id": { "type": "string" },
    "union_id": { "type": "string" },
    "source": {
      "type": "object",
      "additionalProperties": true
    },
    "raw_data": {
      "type": "object",
      "additionalProperties": true
    },
    "user_content_blocks": {
      "type": "array",
      "items": {
        "type": "object",
        "additionalProperties": true
      }
    },
    "diagnostics": {
      "type": "array",
      "maxItems": 16,
      "items": { "$ref": "#/$defs/agentDiagnostic" }
    }
  },
  "$defs": {
    "agentDiagnostic": {
      "type": "object",
      "additionalProperties": false,
      "required": [
        "type", "provider", "operation", "stage", "error_name", "observed_error",
        "redacted", "truncated", "cause_known"
      ],
      "properties": {
        "type": { "const": "operation_failure" },
        "provider": { "type": "string", "minLength": 1, "maxLength": 64 },
        "operation": { "type": "string", "minLength": 1, "maxLength": 128 },
        "stage": { "type": "string", "minLength": 1, "maxLength": 64 },
        "error_name": { "type": "string", "minLength": 1, "maxLength": 128 },
        "observed_error": { "type": "string", "minLength": 1, "maxLength": 4000 },
        "redacted": { "type": "boolean" },
        "truncated": { "type": "boolean" },
        "cause_known": { "type": "boolean" },
        "verified_reason": { "type": "string", "minLength": 1, "maxLength": 256 },
        "mapping_id": { "type": "string", "minLength": 1, "maxLength": 128 },
        "http_status": { "type": "integer", "minimum": 100, "maximum": 599 },
        "provider_code": { "oneOf": [{ "type": "integer", "minimum": -9007199254740991, "maximum": 9007199254740991 }, { "type": "string", "minLength": 1, "maxLength": 128 }] },
        "provider_subcode": { "oneOf": [{ "type": "integer", "minimum": -9007199254740991, "maximum": 9007199254740991 }, { "type": "string", "minLength": 1, "maxLength": 128 }] },
        "log_id": { "type": "string", "minLength": 1, "maxLength": 256 },
        "endpoint": { "type": "string", "minLength": 1, "maxLength": 512 }
      },
      "allOf": [{
        "if": { "properties": { "cause_known": { "const": true } }, "required": ["cause_known"] },
        "then": { "properties": { "verified_reason": true }, "required": ["verified_reason"] },
        "else": { "not": { "properties": { "verified_reason": true }, "required": ["verified_reason"] } }
      }]
    }
  }
}
