{
  "platform": "feishu",
  "event_type": "message",
  "user_input": "check inventory",
  "user_id": "ou_user_1",
  "conversation_id": "oc_chat_1",
  "is_group": true,
  "message_id": "om_message_1",
  "sender_nick": "Alice",
  "response_route_id": "route_1",
  "union_id": "on_union_1",
  "source": {
    "platform": "feishu",
    "scope": "group"
  },
  "raw_data": {
    "chat_type": "group"
  },
  "user_content_blocks": [
    {
      "type": "text",
      "text": "check inventory"
    }
  ],
  "diagnostics": []
}
